{
  "task_id": "seed_mix_0009",
  "source_text": "Ops memo: 在 eu-west 环境把 cache_ttl_sec 从 900 调到 600，然后 run verify_cache.sh。Do not purge session-store unless error_rate > 0.02. 结果追加到 cache_audit.log，截止 2026-05-09T11:30:00Z。",
  "language_profile": {
    "primary_language": "mixed",
    "contains_code_switching": true
  },
  "extraction": {
    "doc_type": "runbook",
    "entities": [
      {
        "name": "eu-west",
        "type": "environment",
        "surface_form": "eu-west"
      },
      {
        "name": "session-store",
        "type": "service",
        "surface_form": "session-store"
      }
    ],
    "parameters": [
      {
        "key": "cache_ttl_sec",
        "value": 600
      }
    ],
    "constraints": [
      "Do not purge session-store unless error_rate exceeds 0.02.",
      "Append the result to cache_audit.log by 2026-05-09T11:30:00Z."
    ],
    "actions": [
      {
        "action_text": "set cache_ttl_sec to 600 in eu-west",
        "status": "required"
      },
      {
        "action_text": "run verify_cache.sh",
        "status": "required"
      }
    ],
    "artifacts": [
      {
        "artifact_name": "cache_audit.log",
        "artifact_type": "file"
      }
    ],
    "timestamps": [
      {
        "text": "2026-05-09T11:30:00Z",
        "normalized_iso8601": "2026-05-09T11:30:00Z"
      }
    ],
    "numeric_values": [
      {
        "value_text": "600",
        "value": 600
      },
      {
        "value_text": "0.02",
        "value": 0.02,
        "metric_name": "error_rate"
      }
    ]
  }
}
