{
  "task_id": "seed_mix_0003",
  "source_text": "Runbook note: 在 prod 环境把 timeout_ms 调到 1500 ms, then restart order-service, but do not touch billing-service. 结果写入 runbook.md，执行时间 2026-05-01T09:15:00Z。",
  "language_profile": {
    "primary_language": "mixed",
    "contains_code_switching": true
  },
  "extraction": {
    "doc_type": "runbook",
    "entities": [
      {
        "name": "prod",
        "type": "environment",
        "surface_form": "prod"
      },
      {
        "name": "order-service",
        "type": "service",
        "surface_form": "order-service"
      },
      {
        "name": "billing-service",
        "type": "service",
        "surface_form": "billing-service"
      },
      {
        "name": "runbook.md",
        "type": "file",
        "surface_form": "runbook.md"
      }
    ],
    "parameters": [
      {
        "key": "timeout_ms",
        "value": 1500,
        "unit": "ms"
      }
    ],
    "constraints": [
      "Do not touch billing-service."
    ],
    "actions": [
      {
        "action_text": "set timeout_ms to 1500 ms",
        "status": "required"
      },
      {
        "action_text": "restart order-service",
        "status": "required"
      },
      {
        "action_text": "write the result to runbook.md",
        "status": "required"
      }
    ],
    "artifacts": [
      {
        "artifact_name": "runbook.md",
        "artifact_type": "file"
      }
    ],
    "timestamps": [
      {
        "text": "2026-05-01T09:15:00Z",
        "normalized_iso8601": "2026-05-01T09:15:00Z"
      }
    ],
    "numeric_values": [
      {
        "value_text": "1500 ms",
        "value": 1500,
        "unit": "ms"
      }
    ]
  }
}
