{
  "task_id": "seed_zh_0001",
  "source_text": "部署约束：不要在高峰期重启 payment-service。将 retries 设置为 3，并记录到 deploy.log。计划操作时间为 2026-04-27T10:00:00Z。",
  "language_profile": {
    "primary_language": "zh",
    "contains_code_switching": true
  },
  "extraction": {
    "doc_type": "deployment_instruction",
    "entities": [
      {
        "name": "payment-service",
        "type": "service",
        "surface_form": "payment-service"
      }
    ],
    "parameters": [
      {
        "key": "retries",
        "value": 3
      }
    ],
    "constraints": [
      "Do not restart during peak traffic."
    ],
    "actions": [
      {
        "action_text": "set retries to 3",
        "status": "required"
      },
      {
        "action_text": "record to deploy.log",
        "status": "required"
      }
    ],
    "artifacts": [
      {
        "artifact_name": "deploy.log",
        "artifact_type": "file"
      }
    ],
    "timestamps": [
      {
        "text": "2026-04-27T10:00:00Z",
        "normalized_iso8601": "2026-04-27T10:00:00Z"
      }
    ],
    "numeric_values": [
      {
        "value_text": "3",
        "value": 3
      }
    ]
  }
}
