{
  "task_id": "seed_zh_0007",
  "source_text": "变更要求：若 p99 超过 250 ms，不要继续扩容 auth-service。把 feature_flag_login_v2 设为 false，保留 previous_config.yaml，并在 2026-05-07T03:00:00Z 前通知 platform-team。",
  "language_profile": {
    "primary_language": "zh",
    "contains_code_switching": true,
    "script_notes": "Chinese text with embedded English identifiers."
  },
  "extraction": {
    "doc_type": "deployment_instruction",
    "entities": [
      {
        "name": "auth-service",
        "type": "service",
        "surface_form": "auth-service"
      },
      {
        "name": "previous_config.yaml",
        "type": "file",
        "surface_form": "previous_config.yaml"
      },
      {
        "name": "platform-team",
        "type": "team",
        "surface_form": "platform-team"
      },
      {
        "name": "p99",
        "type": "metric",
        "surface_form": "p99"
      }
    ],
    "parameters": [
      {
        "key": "feature_flag_login_v2",
        "value": false
      }
    ],
    "constraints": [
      "Do not continue scaling auth-service if p99 exceeds 250 ms.",
      "Notify platform-team before 2026-05-07T03:00:00Z."
    ],
    "actions": [
      {
        "action_text": "set feature_flag_login_v2 to false",
        "status": "required"
      },
      {
        "action_text": "retain previous_config.yaml",
        "status": "required"
      },
      {
        "action_text": "notify platform-team",
        "status": "required"
      }
    ],
    "artifacts": [
      {
        "artifact_name": "previous_config.yaml",
        "artifact_type": "file"
      }
    ],
    "timestamps": [
      {
        "text": "2026-05-07T03:00:00Z",
        "normalized_iso8601": "2026-05-07T03:00:00Z"
      }
    ],
    "numeric_values": [
      {
        "value_text": "250 ms",
        "value": 250,
        "unit": "ms",
        "metric_name": "p99"
      }
    ],
    "summary": "Disable the feature flag, keep the previous config file, and notify the platform team before the deadline while avoiding further scale-out under high p99."
  }
}
