{
  "task_id": "seed_zh_0010",
  "source_text": "故障处理：将 worker_pool_size 保持为 12，不要重建 metrics-table；如果 backlog 超过 5000，则暂停 sync-job，并把告警发送到 oncall.md。计划窗口 2026-05-10T22:45:00Z。",
  "language_profile": {
    "primary_language": "zh",
    "contains_code_switching": true,
    "script_notes": "Chinese incident-handling instructions with English configuration keys, table or job identifiers, and a timestamp."
  },
  "extraction": {
    "doc_type": "runbook",
    "entities": [
      {
        "name": "worker_pool_size",
        "type": "field",
        "surface_form": "worker_pool_size"
      },
      {
        "name": "metrics-table",
        "type": "table",
        "surface_form": "metrics-table"
      },
      {
        "name": "backlog",
        "type": "metric",
        "surface_form": "backlog"
      },
      {
        "name": "sync-job",
        "type": "other",
        "surface_form": "sync-job"
      },
      {
        "name": "oncall.md",
        "type": "file",
        "surface_form": "oncall.md"
      }
    ],
    "parameters": [
      {
        "key": "worker_pool_size",
        "value": 12,
        "normalized_value": 12
      }
    ],
    "constraints": [
      "不要重建 metrics-table；",
      "如果 backlog 超过 5000，则暂停 sync-job。"
    ],
    "actions": [
      {
        "action_text": "将 worker_pool_size 保持为 12"
      },
      {
        "action_text": "不要重建 metrics-table"
      },
      {
        "action_text": "如果 backlog 超过 5000，则暂停 sync-job"
      },
      {
        "action_text": "把告警发送到 oncall.md"
      }
    ],
    "artifacts": [
      {
        "artifact_name": "oncall.md",
        "artifact_type": "file"
      }
    ],
    "timestamps": [
      {
        "text": "2026-05-10T22:45:00Z",
        "normalized_iso8601": "2026-05-10T22:45:00Z",
        "timezone": "UTC"
      }
    ],
    "numeric_values": [
      {
        "value_text": "12",
        "value": 12,
        "metric_name": "worker_pool_size"
      },
      {
        "value_text": "5000",
        "value": 5000,
        "metric_name": "backlog"
      }
    ]
  }
}
