{
  "task_id": "seed_mix_0003",
  "source_text": "Runbook note: 在 prod 环境把 timeout_ms 调到 1500 ms, then restart order-service, but do not touch billing-service. 结果写入 runbook.md，执行时间 2026-05-01T09:15:00Z。",
  "language_profile": {
    "primary_language": "mixed",
    "contains_code_switching": true,
    "script_notes": "Chinese and English are interleaved with English technical identifiers."
  },
  "extraction": {
    "doc_type": "runbook",
    "entities": [
      {
        "name": "prod",
        "type": "environment",
        "surface_form": "prod",
        "normalized_name": "prod"
      },
      {
        "name": "timeout_ms",
        "type": "field",
        "surface_form": "timeout_ms",
        "normalized_name": "timeout_ms"
      },
      {
        "name": "order-service",
        "type": "service",
        "surface_form": "order-service",
        "normalized_name": "order-service"
      },
      {
        "name": "billing-service",
        "type": "service",
        "surface_form": "billing-service",
        "normalized_name": "billing-service"
      },
      {
        "name": "runbook.md",
        "type": "file",
        "surface_form": "runbook.md",
        "normalized_name": "runbook.md"
      }
    ],
    "parameters": [
      {
        "key": "timeout_ms",
        "value": "1500",
        "unit": "ms",
        "normalized_value": 1500
      }
    ],
    "constraints": [
      "Do not touch billing-service."
    ],
    "actions": [
      {
        "action_text": "把 timeout_ms 调到 1500 ms"
      },
      {
        "action_text": "restart order-service"
      },
      {
        "action_text": "结果写入 runbook.md"
      }
    ],
    "artifacts": [
      {
        "artifact_name": "runbook.md",
        "artifact_type": "file",
        "location": "runbook.md"
      }
    ],
    "timestamps": [
      {
        "text": "2026-05-01T09:15:00Z",
        "normalized_iso8601": "2026-05-01T09:15:00Z",
        "timezone": "UTC"
      }
    ],
    "numeric_values": [
      {
        "value_text": "1500 ms",
        "value": 1500,
        "unit": "ms"
      }
    ]
  }
}
