{
  "task_id": "seed_mix_0012",
  "source_text": "Checklist: 对 billing-api 开启 canary_mode=true，并把 timeout_sec 保持在 45。If error_budget_remaining falls under 15 %, freeze rollout and attach notes to billing_canary.md. 执行记录时间 2026-05-12T05:55:00Z。",
  "language_profile": {
    "primary_language": "mixed",
    "contains_code_switching": true,
    "script_notes": "Chinese and English are mixed across clauses with service and file identifiers."
  },
  "extraction": {
    "doc_type": "deployment_instruction",
    "entities": [
      {
        "name": "billing-api",
        "type": "api",
        "surface_form": "billing-api"
      },
      {
        "name": "canary_mode",
        "type": "other",
        "surface_form": "canary_mode"
      },
      {
        "name": "timeout_sec",
        "type": "other",
        "surface_form": "timeout_sec"
      },
      {
        "name": "error_budget_remaining",
        "type": "metric",
        "surface_form": "error_budget_remaining"
      },
      {
        "name": "billing_canary.md",
        "type": "file",
        "surface_form": "billing_canary.md"
      }
    ],
    "parameters": [
      {
        "key": "canary_mode",
        "value": true,
        "normalized_value": true
      },
      {
        "key": "timeout_sec",
        "value": 45,
        "normalized_value": 45
      }
    ],
    "constraints": [
      "If error_budget_remaining falls under 15%, freeze rollout",
      "If error_budget_remaining falls under 15%, attach notes to billing_canary.md",
      "Record the execution at 2026-05-12T05:55:00Z"
    ],
    "actions": [
      {
        "action_text": "Enable canary_mode=true for billing-api",
        "target": "billing-api",
        "status": "required"
      },
      {
        "action_text": "Keep timeout_sec at 45",
        "target": "timeout_sec",
        "status": "required"
      },
      {
        "action_text": "Freeze rollout",
        "target": "rollout",
        "status": "required"
      },
      {
        "action_text": "Attach notes to billing_canary.md",
        "target": "billing_canary.md",
        "status": "required"
      }
    ],
    "artifacts": [
      {
        "artifact_name": "billing_canary.md",
        "artifact_type": "file"
      }
    ],
    "timestamps": [
      {
        "text": "2026-05-12T05:55:00Z",
        "normalized_iso8601": "2026-05-12T05:55:00Z",
        "timezone": "UTC"
      }
    ],
    "numeric_values": [
      {
        "value_text": "45",
        "value": 45,
        "metric_name": "timeout_sec"
      },
      {
        "value_text": "15 %",
        "value": 15,
        "unit": "%",
        "metric_name": "error_budget_remaining"
      }
    ]
  }
}
